{
  "format": "entrance-parts",
  "version": 1,
  "id": "new-area-entrance",
  "themes": [
    "new-area"
  ],
  "image": "atlas-32.png",
  "tileSize": 32,
  "width": 64,
  "height": 64,
  "parts": {
    "leftJamb": [
      [
        0,
        0,
        32,
        32
      ]
    ],
    "rightJamb": [
      [
        32,
        0,
        32,
        32
      ]
    ],
    "lintel": [
      [
        0,
        32,
        32,
        32
      ]
    ],
    "threshold": [
      [
        32,
        32,
        32,
        32
      ]
    ]
  }
}
